author,text,date,title
EDWARD STEPHENS,"Taking stock of another epic Easterns.
APRIL 7, 2023 BY EDWARD STEPHENS IN RECAP WITH 0 COMMENTS
 UNC’s Ben Dameron scores a goal in the first half of the 2023 Easterns’ final against Vermont. Photo: Brian Whittier.
Ultiworld’s coverage of the 2023 college ultimate season is presented by Spin Ultimate; all opinions are those of the author(s). Find out how Spin can get you, and your team, looking your best this season.
LITTLE RIVER, SC – Easterns 2023 delivered on all its promises: exciting semifinals between title contenders, shake-ups in the regional races, and a thrilling finish to the race for the last strength bid made for the best weekend of the year in the D-I men’s division. The headline story is the triumphant return of UNC to the top of the division, but that’s only the tip of the iceberg. Read on for a full recap of a tournament brimming with action.
Pool Play Results
Full Results
Bracket Results
Champions, not Curses
With a convincing 15-10 win over #4 Vermont Chill in the final to cap an undefeated weekend, #2 North Carolina Darkside have thrown off the weight of a decades-old drought1 and re-established themselves as the top team in the division heading into the post-season. It was far from their only impressive result. Their path through the Easterns bracket also included wins over #1 Massachusetts ZooDisc and #8CalPoly-SLO SLOCORE. Now, in spite of a brief stumble at last month’s Smoky Mountain Invite, there is no doubt that UNC have the inside track for the 2023 College Championship.
The final was like the abstract to a research paper, providing a succinct encapsulation of everything Darkside did well all weekend. The O-line steamrolled through every defensive look they faced at the tournament – and, unlike at SMI, they stayed focused enough not falter under the weight of their own mistakes. This time around Ben Dameron, Dylan Hawkins, and Josh Singleton were not only dangerous as they took turns throwing deep to one another from motion, they were also very consistent. The upshot was a ruthless, fine-tuned attack that challenged Chill’s defenders to find the rare opportunities for takeaways.
While those opportunities were rare in Darkside’s downfield flow, they were non-existent in the red zone set, where UNC, as they have for many years, pushed through reset progressions, cuts, and clears with terrifying efficiency. Handler John McDonnell, who was sidelined with an injury and got to take in the spectacle from a more removed vantage, explained what separates the UNC offense from so many others in the division.
“On a lot of O-lines, you have two or three guys that you need to work through, and if they’re not near the disc, you’re going to struggle. But with us, we have so many guys that are comfortable around the disc, especially in the endzone set, that we can be content if we’re not open to get out and make space for someone else,” he said.
All of that success comes with a disclaimer, though. Darkside’s O-line, as good as they were, didn’t often have to play under pressure. That’s because the D-line often staked them to a big early lead. In the final, Darkside scored four goals before Vermont got on the board. “In an ideal world [a big lead] doesn’t affect anything, you play the same offense as normal… but in reality people are humans… And so after a couple of breaks it lets you settle into the moment and not think about, ‘Oh, I better not mess up,’” said McDonnell.
The Darkside D-line don’t play with quite the same panache as the O-line – particularly with Andrew Li and Eli Fried sidelined and Matt McKnight filling in for McDonnell on offense – but they may be the more imposing unit. They often came down in a junk set: switch-ready matchups on two handlers, a triangle of defenders in the secondary facing the downfield receivers and shifting left and right to pick them up, and a pair of deeps to disrupt the early phases of cuts or act as safeties. Opponents had trouble finding any spaces to challenge other than risking a deep look which, though sometimes successful – especially to Vermont’s Carl Crawford in the final orCalPoly SLO’s Anton Orme in semis – started a UNC possession as often as not.
Even without McKnight’s creative throwing and the sparkplug energy of Li, the D-line offense converted break chances at an excellent clip. Kevin Pignone, continuing a fine season, shouldered much of the throwing load, especially when it came to taking shots to the end zone. But Daniel Zhu made his fair share of tricky connections, sophomore Grayson Trowbridge ran the backfield sets with veteran savvy, and freshman Lucien Noël continues to show tremendous promise downfield.
The final was not particularly competitive, even as Vermont’s offense found a rhythm in the second half. The highly anticipated rematch against UMass, which took place in quarters thanks to ZooDisc’s end-of-Saturday flinch against Pittsburgh, was not particularly competitive. None of their pool play games were particularly competitive. An ascendant SLOCORE gave them a little bit of a test in semis, but Darkside maintained a two-break lead through the second half to keep them at arm’s length.
All-in-all, UNC at Easterns gave the impression of cat sharpening its claws against a scratch post. The other teams were competing – but Darkside were just sparring at the gym right through to the end. ““We got to play a lot of depth throughout a lot of the games, including the final. Everyone on the team played in the final, and that doesn’t happen in a lot of big games,” said McDonnell.
And that should put a scare into the rest of the division.
Green Mountain Highs and Lows
Truth be told, the other finalist, Vermont, had a mixed weekend – right in line with their season trajectory, which has seen its share of both staggering wins and head-scratching losses. At their worst – the four- and five-goal losses toCalPoly SLO and UNC – they were off-kilter on offense and generally toothless on defense. Playing closer to their ceiling, however, as they did in close games versus resurgent blue-blood programs #12 Pittsburgh En Sabah Nur and #14 Brown Brownian Motion in the bracket and in commanding Saturday victories against #15 Tufts E-Men and #22 Georgia Jojah, they were adaptable on offense and played the staunchest pure matchup defense at the tournament.
It’s hard to hang an overall judgment on their performance, and not only because of the game-to-game inconsistencies. The O-line that had so much trouble cracking UNC’s junk set in the final missed their two most creative throwers: sophomore Declan Kervick and freshman Casey Thornton. (Kervick, having re-injured himself at Smoky Mountain Invite, was out for the entire weekend; Thornton hurt himself against UNC on Vermont’s first offensive point.) Without them, the offensive sets often devolved into towering deep looks from Johnny Sickles to Carl Crawford. Crawford, the team’s best performer in the final, made it a viable strategy – to a point. But having dug themselves into an early hole, Chill needed more from the D-line than they were able to muster in the moment.
That underperformance, though, was the exception for a line that had been among the sharpest on the weekend. Until the final, the hallmark of Chill was their ability to take possession by force. CJ Kiepert, Ben Payson, and Ryan Bliss were simply outstanding as they hassled the opposition. “We had a lot of guys step up and play really hard in our quarters and semis games to get us here. The defense was phenomenal,” said Kiepert.
Not to be outdone, the O-line were equally stingy – if not always when they had possession, then certainly after they lost it. Sickles, Thornton, and Turner Allen (who had been playing D-line but was filling in for the injured Kervick at Easterns) made opponents’ break chances tricky. Sophomore Zack Watson-Stevens often shut them down entirely, pushing toward the disc with elite-level explosiveness. “Zack Watson-Stevens has to be one of the best defenders I’ve ever seen,” said Kiepert. “[Even though] he plays on the O-line [he] might have led our team in blocks.” He stopped a pair of Pitt counters cold with blocks to keep Vermont ahead in semis. And just like in the third-place game against Colorado at Smoky Mountain, Watson-Stevens crossed over to the D-line for universe point in the quarterfinal against Brown and earned a run-through block to set up the game-winning score.
Vermont, stumbling as the weekend came to a close, will want another chance to pass the UNC test. For the rest, they can walk away secure in their position among the rest of the division’s best. “We’re tough, man. We’re really, really good… If we play our game, no matter who we’re playing, it’s up to us if we want to win. I genuinely believe that we can decide our fate, and we can decide how far we want to go this season,” said Kiepert.
Hitting their Stride: Pitt, SLO
Bonus Content for Easterns 2023: Tournament Recap (Men’s) is only available to Ultiworld Subscribers
Subscribe to Ultiworld
Already have a subscription? Log in
Whether you visit Ultiworld for our reporting, our podcasts, or our video coverage, you can help us continue to provide high quality content with a subscription. By becoming a subscriber, not only do you receive benefits like bonus content and full article RSS feeds, you also help fund all of Ultiworld's coverage in general. We appreciate your support!","April 7, 2023",Easterns 2023: Tournament Recap (Men’s)
JESSE STROD,"WashU win their second tournament in a row and second consecutive Huck Finn
APRIL 6, 2023 BY JESSE STROD IN RECAP WITH 0 COMMENTS
Purdue Undue celebrate at Queen City Tune Up 2023. Photo: Katie Cooper – UltiPhotos.com
Ultiworld’s coverage of the 2023 college ultimate season are presented by Spin Ultimate; all opinions are those of the author(s). Find out how Spin can get you, and your team, looking your best this season.
A deep line-up of teams converged on the St. Louis area this weekend for Huck Finn 2023. The top end knew this would be their last chance to get high-quality reps before setting their sights on poaching a Nationals bid in the postseason, particularly the eventual finalists Washington University Contra and Purdue Undue who were each the top-ranked team in their regions that did not earn a bid.1 As the weekend played out, the teams in Tier 1 (see our Tournament Preview for an explanation of the format) showed their strength and took seven of eight quarterfinal spots. St. Olaf Berzerkers were the only upstart from Tier 2 able to make it past the pre quarters, dismissing Emory Juice 11-8 to earn their way into the last eight. Out of Tier 3, Saint Louis University Archangel continued their strong finish to the season, going 6-1 on the weekend to finish T-9th after being seeded 21st overall.
Pool Play
Bracket Play
Adventures in a Huckleberry Wind
It is an understatement to say that Saturday of Huck Finn was dominated by wind.2 And to be clear, this was not a regular 15-20 mph that creates a serious upwind-downwind game; it was the kind of wind that makes something resembling ultimate functionally impossible. The early scores best illustrate the point: only four of the 32 games played in the first three rounds had a team reach double digits, and there were even some games where that wasn’t mathematically possible (see: Emory 5-3 Notre Dame). Some teams were able to thrive in the chaos and the equalizing weather led to shock results, like the 6-5 universe point win that the Cincinnati Bearcats edged out over WashU in pool play.
By the end of Round 4 on Saturday, the conditions calmed to a level where the sport on the field was appreciably more like ultimate. Strategies switched away from a straight field-position game and the true quality of teams began to show through. After an 11-2 thumping at the hands of Purdue in the tail end of the gusts, Iowa State ISUC were able to rally and hand Indiana Hoosiermama?s a 9-7 loss to end Saturday. That result catapulted ISUC into the bracket and kicked Indiana down into the 15th place bracket. It was the nail in the coffin of an unfortunate weekend for Indiana, who got the short end of the stick from the format and played out Sunday against weaker competition.3 At the end of Pool Play, WashU and Purdue earned the bye into the quarterfinals while Wisconsin-Milwaukee, Kentucky, Marquette and Grinnell joined SLU and St. Olaf as the challengers to Tier 1 in the pre quarters.
The bracket went chalk in the quarterfinals with no upsets in sight except for Notre Dame’s challenge to ISUC, though ISUC made good on their higher seed and pulled out a 9-7 win. Notre Dame’s star handler Chris Walsh was out with a hip flexor injury which allowed other players to step in larger roles. That kind of valuable development will surely raise Papal Rage’s ceiling going into Not-So-Great Lakes Regionals where the weakest Michigan team in recent memory is just waiting to be upset. Elsewhere in the quarters, WashU comfortably got past Alabama, Missouri dispatched the Cincinnati team that had upset Contra the day before, and Purdue ended St. Olaf’s run up the standings.
High-Drama Semifinals
In a preview of the forthcoming Ozarks Conference championship, Mizzou and WashU faced off in the first semifinal. These two teams know each other well as a lot of them play together in the St. Louis club scene and have been building up a friendly rivalry. Mizzou came into this matchup with a chip on their shoulder since WashU has gotten the better of them in past meetings. Unfortunately for the boys from Columbia, Contra’s dominance continued and WashU were able to power through Mizzou 11-8. Mizzou were able to build the most pressure Contra’s offense faced all day but were not able to convert their chances. Senior Ben Reimler basically took over as Mizzou keyed in on WashU’s primary downfield threats Cam Freeman and Noah Stovitz. Reimler called his own number and made two huge plays in the deep space to close out the game.
Despite falling to WashU and finishing third for a third tournament in a row, Mizzou’s coach Ryan Tray had a lot of positives takeaways from the tournament: “We’d never played a tournament where we were playing eight good teams and eight good competitive games. Proving that we could play consistently good ultimate against good competition was the big theme for us going in and we did that.”
Alex Bernier was a difference-maker for Mizzou as one of the few players with the power to consistently flip field position in the intense conditions. Bernier was injured for Sunday and Mizzou definitely missed his ability to stretch the field on the turn.
The second semifinal was an absolute thriller between Purdue and Iowa State. The first half looked very similar to the earlier game where Purdue won 11-2 as Undue got out to a healthy 8-3 lead. Then, just after half Iowa State made some strategic adjustments and started to lock in. ISUC began fronting the Purdue cutters when Undue were going upwind and were able to generate pressure and turns. On the back of momentum-shifting defensive plays from Jeremy Marchesani and Matt Johnson, Iowa State brought the game back to 10-10. On universe, ISUC worked the disc all the way up the field to about 15 yards from the end zone before taking a ill-advised mid-range shot that a Purdue player was able to get to the ground before putting it full-field downwind for a score to win the game. That full-field throw was part of Purdue’s huck-happy offensive strategy going downwind. Undue held a lot of faith in their ability to get a quick turn and then punch the disc in with the short field. Though the risky strategy almost bit them in the back, Purdue escaped with the win and moved on to face WashU in the final.
WashU with a Dominant Display in Final
The final came down to the two clear best-looking teams over the course of the weekend, and everyone was looking forward to it. WashU came into the game with extra motivation because they lost to Purdue in the quarterfinals of MLC back in November.
The wind still played a factor, even as it was comparatively temperate to how it had started. Contra played small-ball to calmly work the disc upwind after Purdue would pin them on their own goal line with a downwind huck, and WashU’s superior depth played a big role. Contra’s 6th and 7th cutters on the D-line regularly got open, with David Higuchi in particular being a steady force downfield. Higuchi always seemed to bail Contra out whenever they found themselves in a tough situation. Junior D-line handler Seth Fisher-Olvera showed great maturity, pairing high-level execution of the basics with the ability to make tough throws when necessary.
On Contra’s offense, Purdue simply had no answer for Noah Stovitz.4 Once Contra converted an upwind break, they ruthlessly sent on a kill line to get the downwinder, and Purdue’s defense couldn’t string together enough consistency on the turn to break WashU upwind. It was a clinical performance from Contra to cap off the best weekend of their season.
To Purdue’s credit, they played a great tournament before meeting their match in the final. Their only games this year had been at Queen City Tune Up where injuries dominated the weekend. Looking to stay healthy and play good reps before the postseason, Purdue’s coach Phil Warren felt they met a lot of their goals, saying, “We had a lot of internal things we needed to work on like mental toughness and making sure we were bringing energy to every game. We were really happy with that. We were able to stay up and motivated the whole weekend.”
Ray Ye showed out for Undue with stout defense and an ability to adjust well to the wind. Ye made his impact alongside strong performances from Andrew Sin,5 the sharpshooting Eric Hoy, and Undue’s multi-tool linchpin Jaxon Moore.
Tournament favorites coming in, WashU did so well on Sunday that they even almost snuck into earning a bid. A few different results across the season and we would have been looking at a 3-bid South Central. Regardless, as back-to-back Huck Finn champions, Contra will be riding high going into Conferences and Regionals. Texas and Colorado should be wary.
All-Tournament Line
Ben Reimler (WashU)
Noah Stovitz (WashU)
Ray Ye (Purdue)
Jaxon Moore (Purdue)
Matt Johnson (ISUC)
John Marsh (Mizzou)
Aidan Vogel (Notre Dame)
According to frisbee-rankings.com, WashU is #22 after #4 Texas and #6 Colorado. Purdue is #38 after #34 Michigan ↩
The tournament has gotten some unfortunate weather luck on Saturday in recent years. You can see the brutal snowstorm that cut 2019’s Saturday short at the beginning of this highlight reel we made followed by the gorgeous weather on Sunday. ↩
This is all incredibly ironic given their choice to forfeit Midwest Throwdown due to perceived weak competition. Would those extra reps have helped them get the few more goals they needed to move into the pre quarters? We’ll never know… ↩
Rumor has it that nearby Scott Airforce Base actually mistook Stovitz for yet another unidentified flying object when he went up for the disc. ↩
Who had been reported to be a smooth lefty handler after MLC but is in fact a righty handler that is just so smooth he could be mistaken for a lefty ↩","April 6, 2023",Huck Finn 2023: Tournament Recap
KEITH RAYNOR,"Wrapping up the regular season!
APRIL 6, 2023 BY KEITH RAYNOR AND CHARLIE EISENHOOD IN PODCAST WITH 0 COMMENTS
Charlie and Keith dive in to Easterns, where UNC took the crown and elite D-I men’s teams made their final regular season statements. They also take a look at the projected final bid picture to see who surprised and disappointed.
Sponsored by Breakmark Ultimate
Note: You can follow Ultiworld and Deep Look on Spreaker. You can also find the Deep Look podcast on iTunes, Spotify, Stitcher, iHeartRadio, Deezer, RSS, Google Play, and your other favorite podcasting apps.
In Out the Back, Charlie and Keith take questions about the new WUL and PUL seasons and the upcoming AUDL season, plus if indoor could be the best ultimate for spectators.
Bonus Content for Deep Look: Easterns Recap, Bid Picture Reactions is only available to Ultiworld Subscribers
Subscribe to Ultiworld
Already have a subscription? Log in
Whether you visit Ultiworld for our reporting, our podcasts, or our video coverage, you can help us continue to provide high quality content with a subscription. By becoming a subscriber, not only do you receive benefits like bonus content and full article RSS feeds, you also help fund all of Ultiworld's coverage in general. We appreciate your support!","April 6, 2023","Deep Look: Easterns Recap, Bid Picture Reactions"
AIDAN SHAPIRO-LEIGHTON,"Can Virginia avoid a third straight 12-11 loss?
APRIL 4, 2023 BY AIDAN SHAPIRO-LEIGHTON IN VIDEO WITH 0 COMMENTS
The college regular season hits full swing on the east coast at Queen City Tune Up. Virginia Night Train faced challenging losses in the first two rounds, losing both 12-11. Facing Notre Dame Papal Rage in the third round, they find themselves once again tied at 11s with one final goal to determine the winner. Will third time be the charm for Virginia?
To watch the rest of our college games in full, check out our subscription options!","April 4, 2023",Universe Point: Notre Dame vs. Virginia
EDWARD STEPHENS,"A huge day of action in Myrtle Beach.
APRIL 2, 2023 BY EDWARD STEPHENS IN NEWS, RECAP WITH 0 COMMENTS
Ultiworld’s coverage of the 2023 college ultimate season is presented by Spin Ultimate; all opinions are those of the author(s). Find out how Spin can get you, and your team, looking your best this season.
NORTH MRYTLE BEACH, S.C. — Saturday of Easterns 2023 gave us a lot of information to process. There was the wind, of course, which wreaked havoc on the complex, turning simple catches and throws into dicey propositions. There were the ups-and-downs of the changing bid picture from round to round — with major implications for the final rounds of play on Sunday. There were unlikely heroes and unlikely goats. And there was the annual struggle to make the top eight of the bracket that always makes for compelling storylines. We’ll break down some of the day’s headlines below. But first let’s take a look at the pool results and bracket.
The Pools
The Bracket
Down Go Zoodisc
By the last round of play at Easterns on Saturday, there was only one remaining team without a blemish in college men’s ultimate: #1 UMass Zoodisc.1 And then, less than two hours later, there were none. #12 Pittsburgh En Sabah Nur secured the 12-11 universe point victory in what is finally a signature win for a program who had been on the hunt for one. It was a sloppy game from both sides as the winds had picked up to their highest level for the 4pm round – I can’t remember a contest between two teams at this level ever having quite so many dropped discs.
Easterns 2023: Day One Headlines, #BidWatch is only available to Ultiworld Subscribers
Subscribe to Ultiworld
Already have a subscription? Log in
Whether you visit Ultiworld for our reporting, our podcasts, or our video coverage, you can help us continue to provide high quality content with a subscription. By becoming a subscriber, not only do you receive benefits like exclusive articles and full article RSS feeds, you also help fund all of Ultiworld's coverage in general. We appreciate your support!","April 2, 2023","Easterns 2023: Day One Headlines, #BidWatch"
