author,text,date,title
EDWARD STEPHENS,"Recognizing the top seven performers of the 2023 season.
JUNE 12, 2023 BY EDWARD STEPHENS, PATRICK STEGEMOELLER, JAKE THORNE AND ALEX RUBIN IN AWARDS WITH 0 COMMENTS
Each year, Ultiworld presents our annual College Awards. Our staff evaluates the individual performances of players from throughout the season, talking to folks around college ultimate, watching film, and look at statistics, voting upon the awards to decide those to be honored. The regular season and the college Series are both considered, with extra emphasis for performances in the competitive and high-stakes environment at Nationals.
Our All-American teams recognize the top performers across the division. While previously we have closed our Awards with our First Team and Second Team, displaying the top seven and next seven players who had the best seasons, they have been moved up in the schedule. As our voting process is ordered, the top two vote-getters for All-American honors, excluding the Player of the Year, will be recognized as our Player of the Year runner-ups. As such, those three players are listed in order, with the runners-up identified; the other four players are listed in alphabetical order.
Player of the Year
All-American First Team
All-American Second Team
Breakout Player of the Year Award
Rookie of the Year Award
Offensive Player of the Year Award
Defensive Player of the Year Award
Coaches of the Year Award
D-I Men’s All-American First Team
Pittsburgh’s Henry Ing at Florida Warm Up 2023. Photo: William “Brody” Brotman – UltiPhotos.com
Henry Ing (Pittsburgh)
“Throw it up to Henry”1 is a frequent play call for the Pittsburgh offense, as he has shown he can consistently embarrass the best cutter defenders in the country with his superior vertical and unfair catch radius. In most cases, he doesn’t even have to use his now-legendary ability to contest the play, as he’ll just burn you deep with his legs and catch the goal in stride. The only real chance of containing him is to pray that the shooters looking for him have a bad day.
Ing has also taken huge strides as a defender with another year of recovery under his belt after a 2019 knee injury. His lateral quickness and fast twitch instincts are even more impressive than pre-surgery. If he guards you downfield, you might as well just bow out – just like all the other contenders for the top awards spot had to do when matched up against him.
For more on Henry Ing, check out his Player of the Year writeup.
Brown’s Jacques Nissen holds the disc at the 2023 College Championships. Photo: William ‘Brody’ Brotman — UltiPhotos.com
Jacques Nissen (Brown) Player of the Year First Runner-up
Before the 2023 season began, Jacques Nissen faced massive expectations as the new face of an elite team. With high level club, college, and AUDL experience, opponents, fans, commentators, and supporters alike knew that Nissen would be the focal point of all things B-Mo this season. Rebounding from a teamwide slow start at Florida Warm Up, Nissen exceeded expectations and carried Brown to a regional championship and a double game point bracket loss to a UNC team that was barely troubled with its other opponents.
Nissen the thrower was a known quantity. His quick flick release, OIIO angles, careful touch and placement, and penchant for over-the-top hits allow Nissen to reach areas of the field that no other college thrower can find and punish defenses for taking their attention away for but a millisecond. This season Nissen showed off a wider skillset, speeding past defenders to reel in deep hucks, anchoring a defense not just as a hidden last-back but as a genuine block threat, and bullying his way to reset spaces designed to be taken away. Nissen was a force on the field and used his skills not to simply carry Brown as far as he could, but to elevate the play of his teammates and form a cohesive unit around his considerable talent.
With another college season ahead, Nissen again has massive expectations. In 2024, they won’t be to fill the shoes of a historically accomplished teammate, but to exceed the incredibly high bar he set for himself with his exemplary play this year.
North Carolina’s Ben Dameron sends a backhand huck downfield at the 2023 College Championships. Photo: William ‘Brody’ Brotman — UltiPhotos.com
Ben Dameron (North Carolina) Player of the Year Second Runner-up
The national final provided a perfect abstract for the particular genius of UNC’s Ben Dameron in 2023. He put up a whopping three goals and five assists – almost exactly proportional to his 12G, 21A line for the entire tournament – on the strength of power cutting in the lane, power throwing from the lane, and flawless play in the red zone set. Honestly, it’s a pretty simple blueprint for how to be an effective ultimate player.
But the simplicity of the method belies the extreme difficulty of executing it over and over again against the strongest, hungriest defenses in the country. It takes an enormous level of polish to read the timing and the spacing through goal box poaches and rolls as consistently as Dameron, to thread an inside forehand from the sideline back to the middle of the field through a narrow window, to take a pristine route on an OI deep shot at full speed. And to execute every time, point after point with the relentlessness of a jackhammer? That’s where routine becomes sublime – which is exactly what Dameron’s performance was this season.
Oregon’s Itay Chang at the 2023 D-I College Championship. Photo: Kevin Leclaire – UltiPhotos.com
Itay Chang (Oregon)
Hero ball is not dead. Or, at least, it wasn’t for the duration of the 2023 season – because Itay Chang revived it. Chang rotated into every role for an Oregon team that sprang back into the national spotlight after a couple of seasons in the wings. On offense, there was no matchup that scared him away from taking the space he wanted, no mark that could keep him from getting off a 20-yd around break through, no team that could slow his turbo-charged give-and-go points. He took the hard shots, and he took the hard cuts. The results? A gaudy feather in his cap in the form of a 12-assist, 16-goal stat line.
But as good as he was on offense, he was even better on defense. Whether it was after the turn or on one of his frequent crossings over to the D-line, Chang fueled opposing throwers’ nightmares for months as he put the chains on their option A receivers – while still giving himself the option to flash-poach option B or C. His game-saving layout block on universe point against Colorado at Presidents’ Day was one of the defining moments of the college regular season. His tremendous work at Nationals – check out the clamps he put on Calvin Stoughton in prequarters or the three blocks he notched againstCalPoly SLO in quarters – was a perfect capstone to a heroic season.
Brown’s Leo Gordon goes up for a catch at the 2023 D-I College Championships. Photo: Sam Hotaling – UltiPhotos.com
Leo Gordon (Brown)
There’s no shortage of great competitors in the college division. It’s common for the top athletes at this level to feel like they are putting all of themselves into the team in pursuit of a championship. But even the players who layout in a four line drill, most strictly follow the intense training regimens, and go sober for months leading up to Nationals do not want to win half as badly as Leo Gordon.
Gordon is a gamer who shows up in the biggest moments and always seems to rise to the top despite the level of competition. Case in point? He threw five assists and scored two goals in a valiant effort against UNC in quarters that came up just short of an earth-shattering upset for Brown.
Even more than in his blistering 2022, it was an impossible task to guard Gordon this season. It was good as guaranteed that he’d get open consistently no matter which defensive assignment is on hand to challenge him. Tremendous disc skills and a knack for clutch blocks – the latter aided by his truly elite straight line speed – only bolster his case as one of the very best players in the division.
Massachusetts’ Wyatt Kellman at the 2023 College Championships. Photo: William ‘Brody’ Brotman — UltiPhotos.com
Wyatt Kellman (Massachusetts)
When Wyatt Kellman was healthy and playing for UMass Zoodisc this season, the team’s only loss was to eventual champion UNC Darkside. That’s a fun stat, but of course there are a million variables that go into why one team wins a game and another doesn’t besides “was Wyatt Kellman playing?” Watch closely when he plays though, and you start to get a sense of why separating UMass’s season into games-with-Wyatt and games-without-Wyatt doesn’t seem so harebrained.
Kellman just did everything for Zoodisc, playing myriad roles on both sides of the disc. Lots of elite players, particularly at the college level, are versatile. They can throw and catch and play defense. But very few players are able to put themselves in the positions and moments to actually impact games with their full range of abilities. Kellman covered every inch of the game with his imprint, seeming to always arrive around the disc or into a crucial defensive position never late or early, but precisely when the situation called for it. He was a safety blanket, passed back and forth by UMass’s O and D-lines, offering steady stability and big playmaking in equal measure.
Of course, the “healthy and playing caveat” matters, and Kellman had to overcome serious injury problems to get on the field this season, missing Easterns and the entire postseason until Nationals. For a player whose presence on the field impacts so much of a game, his lack of presence for swaths of the season was a cruel irony. But when he played, he was everything UMass needed him to be and more.
North Carolina’s Rutledge Smith with a backhand at the 2023 College Championships. Photo: William ‘Brody’ Brotman — UltiPhotos.com
Rutledge Smith (North Carolina)
On a team full of well-rounded offensive threats, UNC most often started their offensive possessions with a pass to Rutledge Smith. Trusted to initiate the most formidable offense in the country, Smith effectively wielded all of the tools of a well-balanced player. Though he effectively functioned as a cog in the Darkside machine, Smith showed off smooth break throws, close catches under pressure, and the occasional flare of a deep shot. At Nationals, Smith opened up another part of his game, acting as an athletic and dynamic finisher. Smith led Darkside with 15 goals at the College Championships, often starting and ending a point with the disc in his hands.
Darkside often worked the disc up the field methodically given the large amount of separation the team’s cutters can generate and the great sense of timing all seven players possess. But, on game point in their semifinal win over Vermont, teammate Ben Dameron launched a trust throw huck to Smith for the game winner. “We tend to have [Smith] more in the backfield,” Dameron said. “But, you know, you can’t sleep on his deep game. He’s extremely fast. He’s very tall, very quick. He’s gonna get separation.” From the start to the end of the point, Smith showed his power to be a star, and he shined brightest in the biggest moments.
I’m paraphrasing ↩","June 12, 2023",2023 D-I Men’s All-American First Team
EDWARD STEPHENS,"Recognizing the top performer of the 2023 season.
JUNE 8, 2023 BY EDWARD STEPHENS IN AWARDS WITH 0 COMMENTS
Each year, Ultiworld presents our annual College Awards. Our staff evaluates the individual performances of players from throughout the season, talking to folks around college ultimate, watching film, and look at statistics, voting upon the awards to decide those to be honored. The regular season and the college Series are both considered, with extra emphasis for performances in the competitive and high-stakes environment at Nationals.
We begin our awards presentation with Player of the Year, our most prestigious award. Our Player of the Year winner is the best performer of the 2023 college season, and the highest vote-getter for All-American honors. The winner is not eligible for consideration in any of our other individual awards. The runner-ups up will be identified as the second and third vote-getters when the All-American teams are revealed.
Player of the Year
All-American First Team
All-American Second Team
Breakout Player of the Year Award
Rookie of the Year Award
Offensive Player of the Year Award
Defensive Player of the Year Award
Coaches of the Year Award
D-I Men’s 2023 Player Of The Year
Henry Ing (Pittsburgh)
Pittsburgh’s Henry Ing at the 2023 College Championships. Photo: William ‘Brody’ Brotman — UltiPhotos.com
At the beginning of April, I was standing in the neutral ground between the two Easterns semifinals when Henry Ing went after a low, overthrown deep shot. It seemed impossible that he would be able to chase it down. And even if he caught up to it, it was beyond conceiving that he could turn it into a completion. (You know where this is going, right?) He left his defender in the distant past, went full flying-squirrel horizontal, and reeled in the catch for a goal. Ing had it all the way. Looking back, it wasn’t even close to a turnover.
The sidelines erupted in appreciation. At the sound of the cheering, one of the coaches watching the other semifinal asked me what happened. “Henry doing Henry things,” I said. That’s all that needed to be said. Henry Ing has been so reliably incredible that his name works as shorthand for anything outrageous that can happen on an ultimate field.
But as we take stock of the season, it’s worth unpacking the phrase “Henry things.” A list of qualities the phrase entails: the straight line speed of a TGV, the lateral agility of a spider, the projectile power of a trebuchet, the vertical of a flea, the field vision of a championship birder. Those “Henry things” translate into a collection of showstopping on-field moments that can only be found together in the portfolio of a single player in the division. Ing’s body of work includes jukes that make handler defenders look as off-kilter as a Picasso portrait, skies that dwarf everyone else in the picture, perfectly programmed heat-seeking hucks, red zone dominator sets that could have been YouTube tutorials, bids that drew comic book onomatopoeic – WHAM! ZOWIE! – up from the turf, lock-and-key downfield and reset shutdowns. There simply wasn’t anyone else like him in 2023 – or maybe any other year either.
Ing’s raw offensive statistics from this year’s College Championships are on the modest side – 10 goals, eight assists. Don’t let them fool you .1 The impact he had on the field for Pittsburgh’s run to quarters was gargantuan. And shapeshifting. He pushed Pittsburgh forward in every conceivable way: Ing was an all-purpose hero.
Our voters, faced with such a complete package, almost unanimously selected him. But his well-rounded, thrilling game doesn’t encapsulate all of who he was on the field. The ribbons on the package are the heart, leadership, and grace he demonstrated throughout his dominant campaign. He commands not only the air, the reset space, and the lanes with his prodigious skillset, but also the respect of his teammates and opponents for the way he carries himself throughout competition. An example in all respects, Henry Ing is without a doubt the 2023 D-I Men’s Player of the Year. Go ahead and add it to the list of Henry things.
Especially because the seven recorded blocks portion of his line is anything but modest. ↩","June 8, 2023",2023 D-I Men’s Player of the Year: Pittsburgh’s Henry Ing
None,"The winners of our College Championships games.
JUNE 7, 2023 BY IN FANTASY WITH 0 COMMENTS
With the 2023 D-III and D-I College Championships in the book, our college fantasy competitions and games are all wrapped up. We picked the winners, guessed the props, and tried to find the upsets and which favorites to target. Hopefully, following along was fun.
But now let’s break down the results and announce the winners of #TheGame for each of the D-I and D-III College Championships, as well as the Beat Charlie Challenge for the D-I College Championships.
D-III #TheGame
Full Scoreboard
The Winners
A pair of winners emerged from the pack, perfect alignment with our prize structure of awarding the topping two finishers. Dalton W. and Micah finished top in first with 565 points, the highest possible score this year. This is the first time, I believe, someone has nailed the perfect lineup. With the closer answer on Tiebreaker 1, Micah earns the first place spot. Both take home a free month of Full Subscription to Ultiworld.
There’s no way around it: D-III #TheGame was chalky. Sadly, I was able to leave this sentence from last year’s writeup. Most of the top scoring teams were the highest seeded, and when they weren’t — St. Olaf in the women’s division and Missouri S&T in the men’s division — they were the most hyped underseeded clubs. This made it really vital to avoid potential landmines like the winless Whitman men’s team. Richmond’s deep run also lends some excitement to making the right pick.
Selection Stats
Top 5 Men’s Teams

The five most popular teams were also the five highest scoring. Nice job, folks! Richmond’s 115 points was the second best, rewarding the quarter of the field that showed faith in the Spidermonkeys. Missouri S&T’s prequarter win was vital to their 90 point total. Northwest duo Lewis & Clark (13.2%) and Whitman (7.3%) were the top seeds to avoid, which most entries did.

The Perfect Lineup
#1 CCollege M
#1 Middlebury M
#2 Richmond M
That’s 565 points, meaning for the first time, we have perfect lineups in the field winning the contest.
The Tiebreakers
The first: what will Whitman men’s and women’s division teams’ combined point differential be for the entire tournament?
As we noted, it was a tough weekend for the Sweets in the men’s division, though -9 isn’t that bad. Fortunately, to big blowout wins for the women’s division club got them back to a combined +10. Nine entries had that exact number!
The second: how many different players will record a goal in either of the men’s or women’s D-III finals?
I quite enjoy this one, so we ran it back. The final answer was 31. That’s five more than last season. Two folks put in the right number. Many people were confused about this because they were putting in numbers in the 100s.
The third: how many points will the no.13 through no.16 seeded men’s and women’s division teams score in pool play?
The bottom seeds managed 187 points. The 106 average guess was well short of that. Root for the underdog!
D-I #TheGame
Full Scoreboard
The Winners
Well, this is awkward. I incorrectly calculated our winners. This year’s winner was Gabriel B, with four of the top scorers ( UNC M, SLO M, Georgia M). Getting the two best sleeper picks was worth 605 points. In second place, Aarov also had both Georgia and SLO, as well as, but brought along and UMass M. Tony C remained in the top three, in third. The previously reported winners will still be receiving prizes from us.
The UNC’s were a popular pairing, making the game mostly about who else you picked.  UMass men’s division teams were great choices, but even better? Georgia and Texas were the highest scoring teams in the men’s division, since UNC phoned in a pool play game. NeitherCalPoly SLO M nor Georgia (10.4%) were totally off the board, but they conferred a big advantage. No entry included both. Meanwhile, Colorado M were probably the weakest selections when accounting for expected value.
Gabriel B wins an Ultiworld Greatest Bag and a free month of Full Subscription from Ultiworld.
Aarov and Tony C each win a free month of Full Subscription from Ultiworld. JBeavs and David P will also receive a free full month of Full Subscription.
Selection Stats

It is no surprise UNC was in almost 80% of the lineups submitted, beating even last year’s tower numbers. But wow, things flattened out quickly. While Colorado was the clear second contender here, it wasn’t by a wide margin and a bunch of teams were clumped together after that. Picking your second team was really a defining characteristic.
Top 5 Men’s Teams
#1 North Carolina (59.2%)
#2 Brown (33.6%)
#2 Pittsburgh (27.2%)
#2CalPoly SLO (22.8%)
#1 UMass (20.8%)
Like in the women’s division, UNC was the big favorite, though by a much smaller margin, and then things flattened out. The second seed teams were understandably quite popular, offering double the points at potentially only a marginal decrease in potential outcome. That probably led to more men’s division teams as the bonus picks, too.
The Perfect Lineup
#1 North Carolina M
#5 Georgia M

#2CalPoly SLO M
A total of 625 points.1
The Tiebreakers
The first: how many total blocks would be recorded in the semifinal games?
42. It is the answer to the ultimate question life, the universe, and everything, including this question (and, spoiler alert: the next one, too.) Only one entry went to this number.
The second: how many pool play games will have a margin of victory of 5 or more goals?
42. That’s more than half of the game 80 games. Two entries got it right.
The third: what will be the combined value of the seeds of the teams that win prequarters across both divisions?
Never tried this one before, so let’s see how it did. The answer was 53, a number three entries landed on. Somebody put 670.
Beat Charlie Challenge
Full Scoreboard
Charlie’s Picks
103 of 416 entries outscored Mr. Eisenhood, who finished with 28 points. That puts Charlie at about the 75th percentile, still a strong score, as he has historically put up.
D-I Men’s
Quarterfinals: #1 North Carolina, #2 UMass, #4 Colorado, #5 Pittsburgh, #6CalPoly SLO, #7 Brown, #11 Minnesota, #12 UC Santa Cruz
Semifinals: #1 North Carolina, #4 Colorado, #5 Pittsburgh, #7 Brown
Final: #1 North Carolina, #5 Pittsburgh
Champion: #1 North Carolina
Scored: 11
What got Charlie was performing slightly below the 11.87 average in the men’s division. Colorado (62%) and Pittsburgh (42%) were the third and fourth most popular semifinalist picks, and Chuck went down with the ship on those. He took a critical hit from having Pitt in the final. A lack of faith in Vermont also turned out to be pretty painful, as 40.6% of entries correctly selected Chill to get through quarters.
The Winners
By random selection of entrants who outscored Charlie, Nicolas S will get an Ultiworld Greatest Bag. Lige M will receive a Free Month of Full Subscription.
Feedback Welcome!
Did you play? Did you not play? Why or why not? What rules would be fun to play with? What tweaks can be made?
We want #thegame and the Beat Charlie Challenge to be fun and have different strategies be viable without being too complicated for lots of people to enter. You can contact me by emailing Editor@Ultiworld.com or on Twitter @FullFieldHammer.
A previous version incorrectly scored both Texas M andCalPoly SLO M, putting the former in the perfect lineup for 645 total points. ↩","June 7, 2023",College Championships 2023: D-I and D-III #TheGame and Beat Charlie Challenge Results
None,"Box scores, including yardage data, from the finals of the D-I College Championships.
JUNE 1, 2023 BY IN ANALYSIS WITH 0 COMMENTS
North Carolina’s Erica Birdsong bids against Colorado’s Stacy Gaskill at the 2023 D-I College Championships. Photo: Kevin Leclaire – UltiPhotos.com
Ultiworld’s written coverage of the 2023 college ultimate season is presented by Spin Ultimate; all opinions are those of the author(s). Find out how Spin can get you, and your team, looking your best this season.
After pioneering work on statistics in 2012 and 2013, we have used the Statto app across a number of events to gather data about team performance, including yardage, to better understand the games we cover and ultimate as a whole.
Here are box scores for each game from the inal matches of the 2023 D-I College Championships. You can sort by any statistic (scroll horizontally in the table to see every column).
D-I College Championships 2023: Final Box Scores is only available to Ultiworld Subscribers
Subscribe to Ultiworld
Already have a subscription? Log in
Whether you visit Ultiworld for our reporting, our podcasts, or our video coverage, you can help us continue to provide high quality content with a subscription. By becoming a subscriber, not only do you receive benefits like exclusive articles and full article RSS feeds, you also help fund all of Ultiworld's coverage in general. We appreciate your support!","June 1, 2023",D-I College Championships 2023: Final Box Scores
